{
  "provider_type": "nova_reel",
  "provider_version": "0.1.0",
  "capability_schema_version": "1.0",
  "discovery": {
    "mode": "static",
    "endpoint": "bedrock-runtime:StartAsyncInvoke",
    "refresh_interval_seconds": null,
    "notes": "Refresh this descriptor when Amazon changes model IDs, regions, task types, or model parameters."
  },
  "operations": {
    "generate": true,
    "download_artifacts": true,
    "poll": true,
    "cancel": true
  },
  "models": [
    {
      "model_id": "amazon.nova-reel-v1:0",
      "status": "stable",
      "execution_topology": {
        "mode": "external_adapter",
        "comfyui_required": false,
        "external_api_required": true,
        "dependencies": ["aws_bedrock_access", "supported_aws_region", "s3_output_location"]
      },
      "structures": ["text_to_video", "image_to_video"],
      "input_constraints": {
        "mime_types": ["image/png", "image/jpeg"],
        "max_image_count": 1,
        "max_video_count": 0,
        "max_audio_inputs": 0,
        "prompt_max_characters": 512
      },
      "output_constraints": {
        "mime_types": ["video/mp4"],
        "max_outputs_per_request": 1
      },
      "dimensions": {
        "supported": ["1280x720"]
      },
      "aspect_ratios": ["16:9"],
      "video": {
        "duration_step_seconds": 6,
        "min_duration_seconds": 6,
        "max_duration_seconds": 6,
        "frame_rates": [24]
      },
      "prompt": {
        "negative_prompt": false,
        "seed": true
      },
      "references": {
        "image_references": true,
        "start_frame": true,
        "end_frame": false
      },
      "audio": {
        "output": false
      },
      "availability": {
        "regions": ["us-east-1", "eu-west-1", "ap-northeast-1"]
      }
    },
    {
      "model_id": "amazon.nova-reel-v1:1",
      "status": "stable",
      "execution_topology": {
        "mode": "external_adapter",
        "comfyui_required": false,
        "external_api_required": true,
        "dependencies": ["aws_bedrock_access", "us-east-1", "s3_output_location"]
      },
      "structures": ["text_to_video", "image_to_video", "multi_shot_automated", "multi_shot_manual"],
      "input_constraints": {
        "mime_types": ["image/png", "image/jpeg"],
        "max_image_count": 20,
        "max_video_count": 0,
        "max_audio_inputs": 0,
        "prompt_max_characters": 4000,
        "multi_shot_manual_prompt_max_characters_per_shot": 512
      },
      "output_constraints": {
        "mime_types": ["video/mp4"],
        "max_outputs_per_request": 1
      },
      "dimensions": {
        "supported": ["1280x720"]
      },
      "aspect_ratios": ["16:9"],
      "video": {
        "duration_step_seconds": 6,
        "min_duration_seconds": 6,
        "max_duration_seconds": 120,
        "frame_rates": [24]
      },
      "prompt": {
        "negative_prompt": false,
        "seed": true
      },
      "references": {
        "image_references": true,
        "start_frame": true,
        "end_frame": false
      },
      "audio": {
        "output": false
      },
      "availability": {
        "regions": ["us-east-1"]
      }
    }
  ],
  "sources": [
    {
      "url": "https://docs.aws.amazon.com/nova/latest/userguide/video-generation.html",
      "kind": "official_api",
      "retrieved_at": "2026-08-12"
    }
  ]
}
